,instancia,profesor,clase,ayudantia,corte,curso
0,Que se mantenga la dinamica de separar por dias las prueba teorica de la práctica,Que se agregue una mesa mas en los practicos a fin ,El orden de los contenido,sigan con los seminarios hechos desde la casa,muchos compañeros llamaban chuletas a los cortes y eso lo encuentro falta de madurez y de respeto. ,Orden y organizacion 
1,Me gustaria que se hicieran mas ayudantías antes de las pruebas ,disminuir el numero de alumnos por mesas ,Que se pongan de acuerdo si se va a prorizar el contenido de las clases o el de la bibliografía,Ayudantia en horarios más comodos,,un docente diferente en el paso por el laboratorio y en cada estación.
2,ayuda mas si es la teórica primero ya que se aprenden contenidos de la practica en el estudio de la teorica.,6 a 8 alumnos por mesa permitiendo un aprendizaje mas personalizado,"que los practicos sean mas clase, en vez de dejarnos solos a identificar estructuras.",Profundizar mas en los casos clinicos de seminario.,,muchos por sección muchas veces uno no alcanza a ver o a escucha bien los preparados de cada estación. 
3,Mas casos clinicos o instancias para desarrollarnos de forma clínica,capítulos a leer para obtener la información desde una fuente que le aporte para el aprendizaje.,que se aconseje un libro para el estudio de una determinada materia,Mantener los seminarios clínicos donde teníamos que descubrir  la patología del paciente,,que se vigile un poco más el orden de los grupos
4,Que se pudieran mantener las solemnes teórica y practica en instancias separadas,"Debería haber un acuerdo previo entre los profesores en cuanto a contenidos, limites, etc. ","Creo  que tener clase teórica separada en varios días ayudaría más, que tener vario bloques juntos. ","ya que poseen óptimo conocimiento, pero al momento de enseñarlo se nota dificultad.",,la organización del curso
5,Encuentro mejor hacer la yincana antes de la prueba teórica.,Practicos de pelvis mas cortos ya que era muy poca materia. ,hacer un bloque todos los días ayudaría a poner más atención en cada clase y no perder el hilo conductor de la materia.,mantener o aumentar la cantidad de seminarios clínicos,,Conservar: Orden del curso
6,Creo que seria mejor tener siempre la solemne teorica antes que la practica.,Me gustaría destacar la buena disposición que los profesores tenían cada dia,Creo que se podria mejorar y progundizar mas las clases de imagenología,Mayor cantidad de seminarios para profundizar la anatomía clínica.,,la organización del curso
7,ojala sigan con la distribución de prueba teórica y práctica.,Los profesores deben anotar los puntos en que no estan de acuerdo entre si y resolverlo ,Me gusto mucho tener clases en la sala AS107. (Mejor sala que el semestre pasado),grabar practicos para poseer un mayor conocimiento de estructuras anatómicas.,,Me gustaría que se mantuviera la excelente relación que se formó con los docentes y entre ellos. 
8,"Ver torax despues de cuello, para mantener una continuacion en las relaciones anatómicas.",Los profesores deben estar de acuerdo con la porcion mas larga de la tuba uterina. ,Que haya mayor acuerdo entre los profesores sobre las estructuras mostradas en las clases prácticas,"un poco más dirigido a casos clínicos, que es cuando se consolida el conocimiento (desde mi punto de vista).",,Considero que la metodología del curso se debe mantener
9,Me gustaría que se mantuviera que nos proporcionen una guía de autorregulación,Podrían colocar cámaras en los prácticos con los cadaveres puesto que al ser muchos por mesa no todos alcanzan a ver.,Dedicar dentro de lo posible clases con inervación e irrigación de estructuras ,Quizás sería bueno el reducir un poco más la cantidad de personas por mesa,,que hagan mas preguntas dirigidas a cada uno en cada una de las estaciones 
10,actividades que nos dieron la posibilidad de subir las notas de controles,Mantener la relacion de los profesores con los alumnos,las clases teóricas y prácticas me parecieron adecuadas para el buen desempeño del estudiante. ,algo a mejorar podría ser modificar el horario de las ayudantías de pabellón abierto ,,Me parece que el curso cumple la mayoria de los objetivos
11,revisiones de las pruebas y las yincanas de práctica. Son instancias que se agradecen mucho. ,Mayor preparación en el ámbito docente en los profesores,la buena disposición de los profesores ayudaba a tener un excelente ambiente en clases y mejor atención del alumnado.,Con respecto a las ayudantías se podría mejorar la disponibilidad de horarios.,,
12,Me gustaría que los ayudantes tuvieran mayor presencia en nuestro estudio. ,Deberían hacer que un profesor mejore sus prácticas pedagógicas ,que recomendaran la bibliografía según el temario porque hay libros que se contradicen ,Ayudantia en horarios más comodos,,
13,Quizá podría ser una buena opción que sugirieran más videos sobre operaciones y disecciones a cadaveres,además el profesor mejore su actitud,la forma en la que pasaron los contenidos ayudaron a que fijáramos los conocimientos de mejor manera y aprendiéramos más. ,Cambiar: Forma de enseñar imagenologia ,,
14,Mejorar preguntas en pruebas,El profesor se ve influido por sus emociones y eso ha afectado a muchos compañeros.,Me gustaría que en materia teórica fueran establecidos con certeza durante las clases,mejorar la organización de las ayudantias,,
15,"Los trabajos que se hicieron para subir las notas, como dibujos y maquetas fueron muy utiles",calificar el aporte del alumno en le practico y no para castigar.,Me gustaría que los temas que difieren en diferentes libros fueran establecidos con certeza durante las clases,Arreglaría las ayudantías.,,
16,Tengo solo una crítica y es con respecto a los ayudantes. ,Que se mantenga el interés de los profesores por enseñar,ser mas ordenados a la hora de dictar las clases teóricas,buscaria una forma más didáctica de realizar videos.,,
17,se noto que para algunos ayudante  era una prioridad y para otros no tanto,que exista la posibilidad de poder grabar los prácticos. ,ojala las clases fueran más específicas para asi saber mas de la materia y entenderla mejor,En algunos casos podria haber mas coordinacion acerca de los horarios,,
18,hay que poner mejor ojo en los criterios de selección de ayudantes.  ,Me gustaría que las mesas de práctico no sean de tantos alumnos ya que dificulta el aprendizaje,Más clases con el profesor R,realizar más ayudantías y seminarios.,,
19,muchas gracias por contribuir en mi formación ,Mejor organización de los tiempos durante las estaciones de los prácticos.,"Por otra parte hubieron algunos temas, materia que se pasaron de manera muy superficial y rápida",,,
20,espero no defraudarlos en el futuro. Un abrazo!,Muchas veces la cantidad de personas por mesa en un practico dificultó el poder ver lo que el profesor estaba explicando ,Las clases con los profesores K y G se van por las ramas en temas que ellos reconocen que no son tan importantes.,,,
21,Me gustaría que se mantuvieran las instancias de repaso previas a las solemnes,en algunos casos no se podían ver los prácticos. ,consenso con respecto a detalles de la materia que varían según autores (como lo son inervaciones o inserciones de ciertos músculos).,,,
22,ojalá invertir mas recursos en  material cadaverico,poder proyectar los prácticos en algún sector para que todos puedan ver lo que se está mostrando. ,esa ambigüedad generada genera ansiedad entre nosotros y es contraproducente con el estudio y el mismo aprendizaje.,,,
23,que hayan más actividades practicas de medicina como anatomía de superficie.,No me parece correcto preguntar materia diferente en los controles a la que se verá en el práctico,tener material audiovisual más ordenado/ o guías de materia para estudiar ,,,
24,más instancias para revisar el material del pabellón,todo lo aprendido teóricamente lo refuerzo en los prácticos y aprendo mucho más en esa instancia que con imágenes solamente.,que todos los profesores lleguen a un consenso con respecto a los contenidos para evitar ambigüedades. ,,,
25,"Interrogaciones por excusas como tener el pelo largo, no ponerse el gorro, etc. ",los profesores manejan la materia con suma claridad. Muy conforme por ese lado. ,que haya uniformidad en los contenidos ,,,
26,me gustó la yincana de desarrollo en vez de una prueba teórica y una práctica ,Que se mantenga la participación de todos en los prácticos,Creo que deberían mandar los ppt antes de las clases,,,
27,me gusta tener dos pruebas por separado. ,Mejorar puntualidad de profesores,que suban los ppt una media hora antes para tenerlo descargado antes de clases ,,,
28,"que las evaluaciones de las solemnes teóricas sean más parecidas a los controles, no solo alternativas.",Más ayuda en los practicos,También que las clases estén mejor organizadas de acuerdo a cantidad de materia y tiempo,,,
29,Se deberían dar más instancias de poder revisar los materiales del práctico,Dinamica de practicos y yincana,los últimos contenidos de cada clase casi ni los explicaban quedándonos con diapositivas sin ver.,,,
30,"se deberían explicar de manera clara y completa, especialmente este ramo, anatomía, un ramo el cuál es base para todo lo que viene después.",más inversión en profesores doctores,"Creo que es muy importante que las clases teóricas las haga solo el profesor l o que haga él mas clases teóricas, ",,,
31,Más instancias que repasen anatomía clínica y se le de énfasis a ello.,Que dejen a los alumnos grabar en el laboratorio,Clases más claras y ordenado y sabe enfatizar en las cosas importantes ,,,
32,evitar una desigualdad en cuanto a lo que aprende cada estudiante. ,Organizar las ayundantías en un horario que sea apto para la mayoría (como el 1er semestre),Sugerencia: explorar el uso de plataformas digitales (programas o aplicaciones) en clase,,,
33,Cabe destacar lo positivo de las instancias prácticas ya que la mayoría de las dudas se aclaran aquí.,no hacer ayudantias luego de los practicos ,Más organización en el tiempo de las clases para abarcar la materia de los prácticos que luego se evaluará. ,,,
34,"Muy buenas las instancias donde, sea a través de clínica, seminarios o ayudantías",consenso entre los profesores porque en muchas instancias se contradecian entre ellos. ,Me gustó la dinámica de las clases,,,
35,Que se mantengan las yincanas de práctica. ,La ausencia del profresor l durante el semestre se notó. ,"Me gusta también la cercanía que tienen para hablar y tirar la talla, da gusto ir a clases a así. ",,,
36,Que los ppt tengan la informacion bien y sea coordinada la entrega de informacion,el profesor g mejoró sustancialmente su trato y disposición a enseñar con respecto al semestre anterior. ,Cambiar o definir com más precisión el libro del cual se deba estudiar y guiar para las solemnes.,,,
37,Que las interrogaciones y controles sean instancias en las que realmente podamos medir lo aprendido para el práctico. ,Me gustaría realmente que los profesores pudieran llegar a un consenso entre las definiciones y conceptos controversiales ,creo que no se debería incluir en los controles y paso práctico la clase realizada justo en el bloque anterior,,,
38,son solo máximo 10 minutos de control. ,Mantener el trabajo de cortes que se realizo en los últimos practicos del semestre. ,considero poco práctica la realización de una única hora de clases por día,,,
39,Sería ideal que los controles sean de salida,Mas trabajo con los ayudantes explicar con calma a los alumnos las dudas,que el profe letelier haga mas seguido las clases teoricas ,,,
40,a veces habían grupos muy grandes donde no se podía hacer mucho y otros grupos muy chicos. Podrían equilibrar eso,La flexibilidad de los profesores y su buena disposicion,Me gustaria que el horario fuera clases y practico,,,
41,Darle un mayor énfasis al aspecto clínico de la anatomía,Los seminarios y la particularidad que tiene cada profesor en enseñar en los prácticos. ,ser mas ordenados a la hora de dictar las clases teóricas,,,
42,que se adicionen en las pruebas de yincana más puestos de anatomia de superficie bien.,Agradezco la preocupación por parte de los profesores respecto a la integridad total del alumno,la clase se vuelve tediosa y afecta en el aprendizaje del contenido que se esta viendo. (como sucedió con la materia de miembros),,,
43,mantener la corrección de solemnes y la de controles a final del semestre. ,Mantener cerca los días del teórico con el práctico ,Las clases teóricas de 3 módulos no cunden mucho  ,,,
44,Que primero fueran las yincanas y despues las teoricas,Que se agregue una mesa mas en los practicos a fin ,responder dudas personales y un resumen de la clase anterior,,,
45,"Me gustaria que cambiara el hecho de que para imagenologia, aparescan cortes del pabellon de anatomia",Agregar ayudantías opcionales con ojalá entrada al práctico,"me parece que en las clases en que falto más de la mitad del curso, se perjudicó de cierta forma a los alumnos que igual fueron a clases ",,,
46,"Quizas seria mas util incluir solo examenes como radiografias, etc, resonancias e incluso incluir las angiografias",que sigan los controles en prácticos porque ayuda a avanzar la materia y a entenderla bien en el mismo,no necesariamente premiar a los alumnos que van a clases (ya que es la obligación de cada uno) ,,,
47,Más ayuda imagenologia,Me gustaría destacar la buena disposición que los profesores tenían cada dia,que en las evaluaciones se evalue lo visto en clases ,,,
48,Me gusto que tengamos el dia libre cuando la otra seccion tenia practico y al revez,que en los prácticos haya una mayor participación por parte de los profesores ,"Mantener ocasiones donde se aprende a relacionar conceptos anatomicos entre sí y con fenómenos clínicos, promueve motivacion.",,,
49,"Promover plataformas electrónicas para aprender anatomia (morfo, imaios, simuladores, apps de atlas de anatomia, etc)",Que se mantenga la preocupación y constante disposición de los profesores en torno a las inquietudes de los alumnos,incorporarlas en clase plataformas para aprender anatomia,,,
50,poder arrendar el material y así mejorar las posibilidades de aprender. ,la cercania de los profesores y su buena disposicion. ,Ojalá el profesor l no se apareció en todo el semestre a clases,,,
51,Mantener las correcciones de las pruebas ,Me gusta mucho la cercanía de algunos profesoras y la preocupación de ayudarnos a entender las cosas. ,coordinación de inervaciones y fuentes ,,,
52,subir las notas de solemnes y controles a tiempo. ,"Es bueno que se mantenga un buen ambiente, como el uso de bromas y de respeto entre alumnos y docentes.",se debiese establecer una bibliografía base y otras complementarias. ,,,
53,"organizar mejor las yincanas, práctica y de imagen ",Me gustaría que mejore el tema del aprendizaje en los prácticos .,"A veces los autores se contradicen en ciertos contenidos entre ellos y con los enseñados en clase, eso genera confusión y ansiedad.",,,
54,Encuentro muy bueno que se revisen las pruebas al tiro.,"Fue un muy buen curso, los profesores son muy cercanos ","El practico en días diferentes a las clases teóricas, permite organizarse mucho mejor. ",,,
55,Devolver pruebas y controles a tiempo,Mantener la buena onda entre porfesores y alumnos. ,"las clases fueran un poco menos tediosas, esto especialmente enfocado a las que son de pared y estructura osea. ",,,
56,el material (cadáveres desgastados y fantomas con errores). ,Tener más espacio en los prácticos y tiempo,Mas exigencia con la asistencia de clases. ,,,
57,Arreglaría  las evaluaciones (sobre todo los controles de imagenología),,"Profe l debe evaluar las clases de los otros profes, preguntarse, de verdad los alumnos les queda con lo que dicen?",,,
58,"Que se mantenga el orden de las pruebas, primero teórica y después la yincana.",,que existiera un consenso de la bibliografía a utilizar para las evaluaciones,,,
59,avisar con anticipación si hay eventual cambio de actividad,,Más clases con el profesor R,,,
60,Que se respete el cronograma dado en un principio,,profesor g no está capacitado para realizar clases teóricas,,,
61,Mayor cantidad de actividades prácticas,,"Clases teóricas divididas, no tres horas pedagógicas de clase.",,,
62,Seria buena idea implementar lo de los videos a modo de repaso,,Sentí que las preparaciones de clases fueron pocas. ,,,
63,Que manden los ppt con anticipación ,,Mantuvieran la organización del curso con sus respectivas clases teóricas ,,,
64,Un aspecto que me gustaría que se me mantuviera en este ramo son los videos que muestran intervenciones quirúrgicas.,,mayor responsabilidad en el tema de los ppts,,,
65,"Que nos entreguen los controles, que en este semestre no los entregaron todos. ",,Complementar las clases con videos,,,
66,Eliminar el sistema de videos ,,Creo que se deberia tener mas instancias practicas ya que permiten fijarlos conocimientos de las clases teóricas ,,,
67,Que se mantenga la separación de la prueba practica de la teorica,,Mantener los videos como complemento a las clases,,,
68,Que las notas de los controles se manejará en un documento ordenado ,,"Para las yincanas, creo que faltan métodos para identificar y recordar los elementos enseñados en clases",,,
69,que se subieran periódicamente las notas para poder lleva un seguimiento de nuestro rendimiento ,,no implementar el sistema de videos en vez de clases ,,,
70,No realizar videos para explicar asignaturas,,"Que no se hagan videos para pasar la materia, sino que hacer la clase correspondiente",,,
71,"Que sigan las actividades practicas como pintar, dibujar en los compañeros y cosas divertidas! ",,Mencionar materia o conceptos en clases o prácticos que posteriormente son evaluadas en solemnes,,,
72,Me gustaría que se mantuviera que nos proporcionen una guía de autorregulación,,sugerir cuál es la bibliografía más adecuada para la unidad,,,
73,"El programa que nos mostraron en clínica de mmss, el cual después de la encuesta no se supo nada más",,Me gustó la dinámica de las clases,,,
74,Que primero fueran las yincanas y despues las teoricas,,Me gustaria que el horario fuera clases y practico,,,
75,"Nada malo que decir, me encanta la u, la carrera, la dedicación de los profes y anato es bacán",,Mejoraría  el hecho de que en las clases teóricas se logre cubrir la clase completa en el tiempo estimado ,,,
76,Que se mantengan las preparaciones de yincanas,,que se suban los ppt antes del comienzo de las clases teóricas. ,,,
77,revisión después de realizar las yincanas,,Sería bueno que en las clases teóricas los profes no se fueran tanto por las ramas,,,
78,que existan revisiones de la yincana con fotos,,Muchas veces clases de una hora aproximadamente terminaban siendo 3 horas,,,
79,revisión con un comité de delegados inmediatamente posterior a la yincana,,"partir con puntualidad las clases sería muy bueno, que algunas veces partiamos más tarde de lo normal",,,
80,en varias pruebas existió ambigüedad respecto a cosas que estaban mal pinchadas o no se entendían,,Creo que deberían mandar los ppt antes de las clases,,,
81,las pruebas teóricas y prácticas hacerlas por separado creo que generaría una mejora en ambas pruebas ,,Creo que deberían hacer la clase de inervación de cabeza antes que las de músculos y anexos de cabeza,,,
82,Falta un poco de orden respecto a las notas y controles.,,Mejoraría las salas de las clases teóricas,,,
83,Me gustaría que la yincana estuviese un poco más separada de la teórica para poder estudiar bien para las 2 pruebas. ,,Que las clases sean un poco más ordenadas en cuanto a la organización de la materia ,,,
84,Encuentro mejor hacer la yincana antes de la prueba teórica.,,Mantener lo completa que son las clases y lo choros que son los prácticos. ,,,
85,que nos puedan dar más material para estudiar para las evaluaciones prácticas. ,,Agregaría ayudantías para las materias que fueran mas difíciles y mas complicadas. ,,,
86,Haría mas actividades dinámicas como las de la estación 4,,Cambiaria los controles de los dias miercoles en los que entraba materia pasada el lunes. ,,,
